{
  "invoice_id": "issue-101-20260613T120000Z",
  "issue": 101,
  "repo": "ReclaimByDesign/dispatch",
  "status": "completed",
  "branch": "pipeline/issue-101",
  "pr_number": 42,
  "scope_actual": "xs",
  "route_used": "gen-local",
  "cost": {
    "tokens_in": 1400,
    "tokens_out": 380,
    "duration_seconds": 21.3,
    "model": "openai/Qwen3-Coder"
  },
  "artifacts": [
    "src/pages/menu/chicago-dog.tsx",
    "https://github.com/ReclaimByDesign/dispatch/pull/42"
  ],
  "errors": [],
  "summary": "Fixed null product_id on the Chicago Dog page. The component was reading `product.id` before the async fetch resolved; added a guard so the cart POST waits for a valid id. One-line fix in chicago-dog.tsx, CI green.",
  "timestamp": "2026-06-13T12:00:00Z"
}
